Name,Description,Category,Level,Price,Estimated Price,Tags,Benefits,Prerequisites,Video Titles,Video Sections,Video Lengths,Video Links
Complete Java Course: From Beginner to Advanced ,"Complete Java Course: From Beginner to Advanced 🚀

Welcome to the ultimate Java Programming Course, designed to take you from a complete beginner to an advanced Java developer! Whether you're just starting with programming or looking to enhance your Java skills, this course provides a comprehensive and hands-on learning experience.

What You’ll Learn:
✅ Introduction to Java – Basics, features, and setting up the development environment.
✅ Java Syntax & Data Types – Variables, data types, operators, and control flow statements.
✅ Object-Oriented Programming (OOP) – Classes, objects, inheritance, polymorphism, abstraction, and encapsulation.
✅ Exception Handling & Debugging – Learn how to handle errors and debug effectively.
✅ Java Collections Framework – Lists, Sets, Maps, and Queues for efficient data management.
✅ Multithreading & Concurrency – Understand how to build efficient and parallel programs.
✅ File Handling & I/O Operations – Read/write files and work with input/output streams.
✅ JDBC & Database Connectivity – Connect Java applications with databases like MySQL.
✅ Spring Framework & Web Development – Build real-world applications with Spring Boot.
✅ Java for API Development – RESTful APIs, JSON handling, and integration.

Why Learn Java?
🔹 Java is one of the most in-demand programming languages for software development, web applications, and Android development.
🔹 It is platform-independent, meaning Java programs can run on any system with the JVM (Java Virtual Machine).
🔹 Used by top tech companies, including Google, Amazon, and Microsoft.

By the end of this course, you’ll have strong Java programming skills and be able to build real-world projects confidently.

💡 Enroll now and start your Java journey today! 🚀🔥",Web Deveopment,Begineer,499,0,"JAVA,FULL SATCK"," Comprehensive Learning Path – This course covers everything from basics to advanced topics, including Java syntax, OOP concepts, multithreading, database connectivity, and web development. Whether you're a beginner or an experienced coder, you'll find valuable knowledge. | Hands-on Practical Experience – You will work on real-world projects, coding exercises, and assignments to strengthen your Java skills. This practical approach ensures you can apply your learning in real development scenarios. |  Career Advancement & Job Opportunities – Java is widely used in enterprise applications, Android development, and backend systems. Mastering Java will open doors to high-paying jobs in software development, web applications, and API development. | Industry-Relevant & Future-Proof – Java is a stable, high-demand programming language used by major tech companies like Google, Amazon, and Netflix. Learning Java ensures long-term career growth in the ever-evolving tech industry.","Basic Computer Knowledge – You should have a basic understanding of how a computer works, including installing software and using text editors. | Logical Thinking & Problem-Solving Skills – Programming requires a logical mindset. If you're comfortable with basic math and problem-solving, you're ready to learn Java. | Familiarity with Any Programming Language (Optional) – While not required, having experience with Python, C, or any other programming language can make learning Java easier. | A Laptop/PC with Java Installed – You need to install Java Development Kit (JDK) and an IDE like IntelliJ IDEA or Eclipse to write and run Java programs. Instructions for setup are covered in the course.",,,,
MERN Stack Mastery: From Beginner to Pro,"Unlock the power of full-stack web development with the Complete MERN Stack Developer Bootcamp. This hands-on course takes you from zero to deployment using the powerful combination of MongoDB, Express.js, React.js, and Node.js — the most in-demand tech stack in modern web development. Whether you're a beginner or an aspiring full-stack developer, you'll gain real-world skills by building interactive frontends, robust backends, and fully integrated applications. Learn how to structure REST APIs, manage databases, handle authentication, and deploy your apps to the cloud. Through practical projects and step-by-step lessons, you’ll master the MERN stack and become confident in building scalable, dynamic web applications. By the end of this course, you’ll not only understand each component of the stack, but also how to connect them to build real-world, production-ready applications. Start your journey toward becoming a professional full-stack developer today!",Web Deveopment,Begineer,1000,0,"MERN,Reactjs,Nodejs,JS,",Master the Full Stack | Real-World Projects | Career Opportunities,Basic Knowledge of HTML/CSS | Fundamental JavaScript Skills | Familiarity with Git,,,,
